{
  "schema_id": "gait.runpack.session_journal",
  "schema_version": "1.0.0",
  "created_at": "2026-02-05T00:00:00Z",
  "producer_version": "0.0.0-dev",
  "session_id": "sess_demo",
  "run_id": "run_demo",
  "started_at": "2026-02-05T00:00:00Z",
  "events": [
    {
      "schema_id": "gait.runpack.session_event",
      "schema_version": "1.0.0",
      "created_at": "2026-02-05T00:00:01Z",
      "producer_version": "0.0.0-dev",
      "session_id": "sess_demo",
      "run_id": "run_demo",
      "sequence": 1,
      "tool_name": "tool.write",
      "verdict": "allow"
    }
  ]
}
